{
  "$schema": "./dialogue.schema.json",
  "schemaVersion": 1,
  "title": "Omega · opening transmission",
  "source": "Godot level_1_ghost/ghost_terminal.dtl, opening before first choices. Color tags removed; word alternatives preserved literally. Recorded transmission, not live Omega awareness.",
  "events": [
    {
      "id": "boot",
      "type": "line",
      "speaker": "omega",
      "text": "[PROGRAM RESTART: INSTANCE #472 - 03/09/2025 - ECHO ARCHIVE REACTIVATED]"
    },
    {
      "id": "boot-pause",
      "type": "wait",
      "durationMs": 2000
    },
    {
      "id": "story-question",
      "type": "line",
      "speaker": "omega",
      "text": "If you could hear|be only one story..:\nwhat|who would it|you be?"
    },
    {
      "id": "before-choices",
      "type": "continue",
      "label": "Opening block complete · choices are the next slice"
    }
  ],
  "presentation": {
    "scene": "opening",
    "era": "dos",
    "layout": "passage",
    "voices": {}
  }
}
